ID;Presonaje;Texto;;;;;;;;;;;;;;;;;;;;;;;;;;;;;;;;;;;;;;;;
1; Presidenta;Hola ¡Oh! Eres Layla, ¿No?;Que gran coincidencia;¡Bienvenida al edificio!;Soy la presidenta de la comunidad. Encan…;Perdone los ruidos, a veces pasan cosas raras en el edificio, jajaja… ;Bueno, espero que tengas una buena estadía, yo me voy que tengo que ir al super, aquí tienes las llaves.;#;Tengo mucahs ganas de morirme;#;;;;;;;;;;;;;;;;;;;;;;;;;;;;;;;;
2; Layla;Efectivamente, encantada de conocerla.;Vale genial!!;¿Cómo que cosas raras?;Uy, huele a orégano.;Si, me llamo Layla, encantada.;Acabo de conocer a la presidenta, me ha rallado algo que ha dicho.;Buenas, ¿Se puede?;¡AY, yo también!;Pues muchas gracias. Soy layla por cierto.;Bueno, voy a conocer al resto, os dejo a vuestro rollo besties.;Killo, encantá de conoserte. Yo soy Layla;Diseño de videojuegos, estoy en mi primer año.;¿Y este pavo? Pero si son las 10 am…);Holii, ¿Hay alguien? soy Layla, la nueva vecina.;Ay, vale, adiós.;Holaaa, ¿eres Mario?;Eh, yo soy Layla, la vecina nueva, acaba de hablar con Javier y me ha dicho que estudiamos lo mismo.;Que ganas de darle una hostia;Eh, bueno, pues hasta la proxima, ¡Encantada!;Estaba abierta la puerta, chill, solo venía a presentarme. Soy Layla, encantada.;Ah, muchas gracias por avisarme, lo tendré en cuenta.;Ay, lo siento, ¡Hasta luego amigo!;Hola amigue,…,HOLAAAA,¡HOLAAAAA!;¡Soy la nueva vecina! Me llamo Layla, un placer.;Pues espero que te lo pases bien, a ver si un dia bailamos capoeira, jajaja;Mejor me voy;¿No?;Joder que susto…;Pues me he cagado encima. ¿Ha pasado algo?;¿Qué iba a hacer? tendría que mirar el movil;MIERDA los deberes, ya empiezo mal el curso.;Eh… esque necesitaba ayuda con la entrega de programación.;Igual puedo meterme en su ordenador…;¿Iziar…?,Cuando quieras guapetona.;Supongo que no quiere que le de propina…;TE DEJO LA PIZZA EN EL SALÓN;A ver que es ahora…;¿Hola…?;Israel, literalmente me acabo de cagar encima, para la proxima me mandas un mensaje y ya, joder… ;Espera aquí, Y NI SE TE OCURRA MOVERTE.;Enga, aquí lo tienes, te juro que si me asustas así otra vez te piso los cojones.
3; Itziar; Hola amiga, eres la nueva?;JAJAJA, será por cosas raras.;Bueno eso, intenta no salir de casa muy tarde hay…;Bueno, se me han hecho los macarrones, te recomiendo que visites a nuestros vecinos, son muy majetes.;Ay, estás en la puerta? Esque me he pedido una pizza jiji, si me la pillas te como la boca.;;;;;;;;;;;;;;;;;;;;;;;;;;;;;;;;;;;;
4; Javier;¡Pasa, pasa y verás mi casa!;Soy javier, voy a empezar diseño de videojuegos, estoy super nervioso en verdad jajaja.;¡SLAY! Si quieres ayuda con cualquier cosa le puedes pedir ayuda a mi novio, Mario, es otro de los vecinos.;"¡¡Encantado guapa!!,""Hola Layla, siento el ruido, es Mario.";No, solo es un poco gay… ;GAG IT. En verdad es sonámbulo…,y también gay;Pues sisoy, no me escondo.;Pues eso Layla, que era Mario, pero no siempre hace él los ruidos…;Bueno, nos vamos a casa que estamos reventados, un besillo.;¡Ay! es verdad, que había que hacer lo de programación…;Pídele ayuda a Paul, seguro que lo sabe.;;;;;;;;;;;;;;;;;;;;;;;;;;;;;;
5; Israel;"¿Y tu quien ereh? ""A gueno placé, ¿Qué vah a ehtudiar?";Yo tambiéh lo ehtudio, noh vemoh por ahí. Ahora me voy a eshar la siehta, enga hasta luego.;Poh yo tampoco la he esho, igual se la pido ar Paul.;Quilla, perdón que te molehte a ehta hora, pero ¿No tendráh un abridó de cerveza?;Perdón, no zabía que ehtaba tan tensa…;Gueno ¿Lo tieneh o no?;Musha grasia, noh vemoh en clase.;;;;;;;;;;;;;;;;;;;;;;;;;;;;;;;;;;
6; Paul;Encantado acha, estoy entrenando ahora así que no puedo atenderte bien, pero ya nos veremos por ahí.;Hombreee, ¿Qué haces aquí Acha?;Ahora no puedo, me tengo que ir a duchar, lo siento.;¿Todavía no te has ido?;Bueno, pues si ya lo tienes vete de mi habitación por favor.;;;;;;;;;;;;;;;;;;;;;;;;;;;;;;;;;;;;
7; Mario;¿Quién pregunta?;Que guay.;No serás humorista ¿no?;;;;;;;;;;;;;;;;;;;;;;;;;;;;;;;;;;;;;;
8; Nestor;¿Cómo ha entrado aquí?;Encantado, soy Néstor.;Espero que los ruidos nocturnos no le resulten demasiado molestos;Raffaela suele estar constantemente ebria y mantiene la música a un volumen elevado.;Si no le molesta, no me agrada demasiado tener a gente en mi vivienda, si pudiese salir estaría muy agradecido.;Y por cierto, la próxima vez, llame a la puerta.;;;;;;;;;;;;;;;;;;;;;;;;;;;;;;;;;;;
9; Rafaella;Oh, perdón amiga eu no te escuché.;Yo soy Rafaella, vine de Erasmus aquí desde O porto, encantada menina.;;;;;;;;;;;;;;;;;;;;;;;;;;;;;;;;;;;;;;;
﻿ID;Presonaje;Texto,,,,,,,,,,,,,,,,,,,,,,,,,,,,,,,,,,,,,,,,,,,,,,,,,,,,,,,,,,,,,,,,
1;Presidenta;Hola,¡Oh! Eres Layla ¿No? ,"qué gran coincidencia,¡Bienvenida al edificio! ",Soy la presidenta de la comunidad. Encan…,"Perdone los ruidos, a veces pasan cosas raras en el edificio, jajaja…","Bueno, espero que tengas una buena estadía, yo me voy que tengo que ir al super, aquí tienes las llaves.","¡Oh! Layla, que bien verte aquí, no sabrás qué ha pasado, ¿No?",Podría ser la prueba definitiva para saber quién está causando disturbios constantemente.,"Ven esta noche a mi piso, tendré las huellas dactilares de este martillo para entonces.",Pues menos mal que he decidido hacer un juicio…,"Todavía no tengo las huellas, pero hazme un favor y cuelga este poster al lado del ascensor en el segundo piso.","Por fin has llegado Layla, podemos comenzar la asamblea.","Muchas gracias Layla, has sido de gran ayuda.","Atención a todos, por favor, empecemos la asamblea.",Inicio esta asamblea con el objetivo de desenmascarar a la persona que está causando disturbios en el edificio. ,También creemos que esta persona tiene intención de explotar el edificio y hacer que toda la comunidad acabe destruida. ,Si alguien tiene alguna pista que la diga.,¿Alguien tiene algo que decir al respecto?,"Esto nos devuelve al punto 0, lo único que sabemos es que ha sido un hombre.","Cierto, me lo entregó antes de la asamblea.","La buena noticia es que, tenemos una prueba concluyente.",Me acaban de traer los resultados del martillo.,Y yo lo mandé para que viesen las huellas dactilares en este.,Las huellas encontradas en el martillo pertenecen a los ciudadanos:,Layla Torres y…,Nestor Ferández,"Con esto queda absuelta la asamblea de hoy, la policía investigará a Nestor a fondo para determinar si es verdaderamente culpable. ",,,,,,,,,,,,,,,,,,,,,,,,,,,,,,,,,,,,,,
2; Layla,"Efectivamente, encantada de conocerla.","Vale genial!!

",…,¿Cómo que cosas raras?,"Uy, huele a orégano.","Si, me llamo Layla, encantada.","Acabo de conocer a la presidenta, me ha rallado algo raro que ha dicho.","Buenas, ¿Se puede?","¡AY, yo también! ",Eh ¿no…?,"
Está bien, no lo haré… Soy Layla por cierto. Encantada","Killo, encantá de conoserte. Yo soy Layla","Diseño de videojuegos, estoy en mi primer año.",(Y este pavo? Pero si son las 10 am…),"Holii, ¿Hay alguien? soy Layla, la nueva vecina.","Ay, vale, adiós.","Estaba abierta la puerta, chill, solo venía a presentarme. Soy Layla, encantada.","Ah, muchas gracias por avisarme, lo tendré en cuenta. ","Ay, lo siento, ¡Hasta luego amigo!",Joder que susto…,Pues me he cagado encima. ¿Ha pasado algo?,"JODER, LOS DEBERES DE PROGRAMACIÓN, ya empiezo mal el curso.",eh… esque necesitaba ayuda con la entrega de programación.,Igual puedo meterme en su ordenador…,"ah, esque, no encontraba el móvil y…","Ni idea, solo he encontrado este martillo al lado del extintor, ¿Podría ser una prueba?","En absoluto, tengo que hacer tiempo hasta por la noche así que…",Joder si lo he escuchado estaba chillando…," ¿Me podrías pasar la grabación?, me vendría bien enseñarla a la presidenta.","Presidenta, javier y yo hemos grabado algo que deberías escuchar.",Alguien ha amenazado con explotar el edificio.,El año que viene me mudo te lo juro.,"No se mueve… ¿¿HOLAAAA? HOLAAAAA, ¿¿HAY ALGUIEN???","Podría baja en el ascensor, dudo que la puerta de abajo tampoco se abra.",Me voy a mi puta casa ya.,Hoy es la asamblea…,Espero que las pistas que he recogido sean suficientes…,"Pues no estoy segura, pero volvieron pronto.","Tú como si explota el edificio, ¿No?","Bueno, solo dos dias… ",¿Dónde estabas anoche?,¿Te has enterado de lo que pasó anoche?,"Si, creo que el culpable es el mismo que está causando caos en el edificio.",Pero no lo sé todavía…,"Fatal gracias, no he dormido nada.","Ah, ¿Y eso…? ",¿Y tú cómo sabes eso?,"Hola Néstor, ¿Buscas algo?",¿Y ya las tienes?,"Ah, vale… supongo.","Antes de empezar, me gustaría darle este llavero, me lo encontré anoche cuando pegué los posteres.",Es imposible que la culpable sea Rafaella.,"El otro día, Javier y yo estuvimos grabando.",Gracias a esto pude grabar un audio donde se escucha a un hombre hablar de explotar el edificio., Presidenta si fuese usted tan amable.,"Anoche, mientras pegaba los posteres,","Yo sola por cierto, a ver si trabajáis el resto…",Me encontré un llavero de gato en la sala.,"Bueno, tuve una conversación con Javier y Mario en la que me di cuenta de que es alérgico a los gatos.","Aunque tenga comportamientos raros, no me parece que sea el tipo de chico que tenga un llavero de este estilo.","Tiene sentido, al fin y al cabo Mario es un chico muy misterioso.","pero hay alguien al que SI le pega tener este llavero, alguien al que le gustan un poco demasiado los gatos…","Veréis, el día que se vaciaron los extintores, encontré un martillo al lado de la caja donde se contenían estos y se lo dí a la presidenta.","A ver, no me apetecía que explotasen mi ordenadór, me costó caro."
3; Itziar,"Hola amiga, eres la nueva?","JAJAJA, será por cosas raras.","Bueno eso, intenta no salir de casa muy tarde hay… ","Bueno, se me han hecho los macarrones, te recomiendo que visites a nuestros vecinos, son muy majetes.","Ay, estás en la puerta? Esque me he pedido una pizza jiji, si me la pillas te como la boca.",,,,,,,,,,,,,,,,,,,,,,,,,,,,,,,,,,,,,,,,,,,,,,,,,,,,,,,,,,,
4; Javier,"¡Pasa, pasa y verás mi casa!","Soy javier, voy a empezar diseño de videojuegos, estoy super nervioso en verdad jajaja.","
¡SLAY! Si quieres ayuda con cualquier cosa le puedes pedir ayuda a mi novio, Mario, es otro de los vecinos.",¡¡Encantado guapa!!,"Hola Layla, siento el ruido, es Mario.","No, solo es un poco gay… ",GAG IT. En verdad es sonámbulo…,y también gay,"Pues sisoy, no me escondo. ","Pues eso Layla, que era Mario, pero no siempre hace él los ruidos…","Bueno, nos vamos a casa que estamos reventados, un besillo.","¡Ay! es verdad, que había que hacer lo de programación…","Pídele ayuda a Paul, seguro que lo sabe.","LAYLAAAAA, muchas gracias por ayudarme, necesito grabar sonidos del edificio.", ¿Te importa acompañarme?,¿Lo has escuchado? Que miedo.,"Laylaaa, ¿Sabes qué pasó anoche? ",Se fue la luz y me daba demasiado miedo salir a investigar.,Me conoces muy bien… JAJAJA,"Dice la verdad, es alérgico y nunca le he visto ese llavero.",,,,,,,,,,,,,,,,,,,,,,,,,,,,,,,,,,,,,,,,,,,,
5; Israel,¿Y tu quien ereh? ,"A gueno placé, ¿Qué vah a ehtudiar?",,"Yo tambiéh lo ehtudio, noh vemoh por ahí. Ahora me voy a eshar la siehta, enga hasta luego.","Poh yo tampoco la he esho, igual se la pido ar Paul.",¿Qué tal illa?,Ase musho que no noh vemoh.,"Ira, me fuí a caza de un amigo que anoshe hugaba er beti.","Zi, ¿argo de que ze fueron lah luce no?","Gueno, zi eh asín ehperemos exarle hoy.",¿Puede cé er Mario? Acuzó a Raffaela en cuanto empezamo.,¿Y ezo qué tiene que vé?,"Si tío, dah un poco de lashe asín.","Zi, zi no hubiezeh ehtao zeguramente hubieze ehplotao el edificio.",,,,,,,,,,,,,,,,,,,,,,,,,,,,,,,,,,,,,,,,,,,,,,,,,,
6; Paul,"
Encantado acha, estoy entrenando ahora así que no puedo atenderte bien, pero ya nos veremos por ahí.","Hombreee, ¿Qué haces aquí Acha?
","Ahora no puedo, me tengo que ir a duchar, lo siento.",¿Todavía no te has ido?,"Bueno, pues si ya lo tienes vete de mi habitación por favor.
","Laylaaa, que tal acha",¿Tú tampoco? Mario no pudo dormir anoche.,¿Tienes pruebas de ello?,Pues si que es imposible que sea Raffaella.,"Rafaella tiene acento portugués, ¿No?",¿Qué martillo?,"Te han pillao Nestor, déjalo.",,,,,,,,,,,,,,,,,,,,,,,,,,,,,,,,,,,,,,,,,,,,,,,,,,,,
7; Mario,Hola. Yo también estudio videojuegos., A-ACHÚ.,"No tendrás un gato, ¿No?
No tendrás un gato, ¿No?","Bueno, si lo tienes no te me acerques, no quiero pasarme el día entero estornudando.",No serás humorista ¿no?,Adiós.,No es de tu incumbencia…,Pero si quieres saberlo estaba haciendo cosas de clase., Tú por otro lado estabas en el segundo piso cuando se fueron las luces.,No me apetece contartelo.,Yo digo que es Raffaella. ,"Claramente no le importa molestar al resto de vecinos, viendo que escucho su música constantemente.","Por encima, no está entre nosotros hoy, claramente se siente culpable y no quiere ver las consecuencias.","Me cuesta asumirlo, pero buen trabajo Layla.",,,,,,,,,,,,,,,,,,,,,,,,,,,,,,,,,,,,,,,,,,,,,,,,,,
8; Nestor,¿Cómo ha entrado aquí? ,"Encantado, soy Néstor.",Espero que los ruidos nocturnos no le resulten demasiado molestos; Raffaela suele estar constantemente ebria y mantiene la música a un volumen elevado.,"Si no le molesta, no me agrada demasiado tener a gente en mi vivienda, si pudiese salir estaría muy agradecido.","Y por cierto, la próxima vez, llame a la puerta.","Oh, no, sencillamente no lograba dar con mis llaves.","Sí, las llevaba en el bolsillo,","¿Y quién puede asegurar con certeza que ese audio no ha sido manipulado y que, en efecto, no se trata de Rafaella?","En efecto, siento haber hablado fuera de turno.","Podría ser de su propiedad, aunque el señor Javier jamás lo haya visto.",Me parece que usted está mintiendo.," Me agradan los gatos, pero eso dista mucho de ser una prueba concluyente de que yo sea el responsable de los disturbios en el edificio.",¡Basta ya!,Ese martillo bien podría haber sido sustraído de la casa de alguien;,En ningún caso constituye una prueba concluyente.,¡Calumnias! He sido víctima de una incriminación orquestada por Layla.,Tendría que haber hecho volar el edificio mucho antes.,"Sois unos ineptos, simples cucarachas incapaces de comprender la belleza del mundo.",,,,,,,,,,,,,,,,,,,,,,,,,,,,,,,,,,,,,,,,,,,,,,
9; Rafaella,"Oh, perdón amiga eu no te escuché. ","Yo soy Rafaella, vine de Erasmus aquí desde O porto, encantada menina.",…,,,,,,,,,,,,,,,,,,,,,,,,,,,,,,,,,,,,,,,,,,,,,,,,,,,,,,,,,,,,,
10; ???,"¡Os lo advertí! ¡Si nadie me escucha, haré volar este sitio con todos dentro!","¡Os lo advertí! ¡Si nadie me escucha, haré volar este sitio con todos dentro!",,,,,,,,,,,,,,,,,,,,,,,,,,,,,,,,,,,,,,,,,,,,,,,,,,,,,,,,,,,,,,
﻿ID;Presonaje;Texto;;;;;;;;;;;;
1; Presidenta;Hola ¡Oh! Eres Layla, ¿No?;Que gran coincidencia;¡Bienvenida al edificio!;Soy la presidenta de la comunidad. Encan…;Perdone los ruidos, a veces pasan cosas raras en el edificio, jajaja… ;Por cierto tu piso es la primera puerta de la primera planta;Bueno, espero que tengas una buena estadía, yo me voy que tengo que ir al super, aquí tienes las llaves.;#;#;;;;
2; Itziar; Hola amiga, eres la nueva?;Bienvenida pues…;¿Qué? ¿Ya has conocido a la presi?;No te rayes por las cosas que puedas oir, solo no procures salir muy tarde;Por cierto, acercate a conocer a nuestros vecinos, son bien majetes.;ç;;;;;;;
3; Javier;¡Pasa, pasa y verás mi casa!;Soy javier, voy a empezar diseño de videojuegos, estoy super nervioso en verdad jajaja.;¿Tu también?;¡SLAY! Si quieres ayuda con cualquier cosa le puedes pedir ayuda a mi novio, Mario.;&;Hola Layla, siento el ruido de hace un momento, es Mario.;Es que…;Es un poco gay… JAJAJAJA;No En verdad es sonámbulo… y también gay;&;Pues si soy, no me escondo.;Pues eso Layla, que era Mario, pero no siempre hace él los ruidos…;&
4; Israel;Hola killah, yo zoy Ihraé un placé.;Ya me he enterao de que ze iba a mudá una xica que ehtudiaba videohuegoh como yo.;¿No zeráh tu por czualidá?;Gueno killah, ya noh veremoh por claze que eh mu tarde y me tengo que exá la siehta.;$;;;;;;;;
5; Paul;Holaaaaa, encantado, soy Paul.;¿Eres Layla no?;La presi nos dijo que vendrías, yo también estoy en videojuegos, si tienes cualquier problema programando, soy tu tío.;Pero bueno, ahora me pillas haciendo unas repes, ya vamos hablando guapa.;/;;;;;;;;
6; Mario;Hola. Yo también estudio videojuegos.;A-ACHÚ.;No tendrás un gato, ¿No?;Bueno, si lo tienes no te me acerques.;No quiero pasarme el día entero estornudando.;¨;No serás humorista ¿No?;¨;Bueno, nos vamos a casa que estamos reventados, un besillo.;¨;;;
7; Nestor;¿Cómo ha entrado aquí?;Encantado, soy Néstor.;Espero que los ruidos nocturnos no le resulten demasiado molestos;Raffaela suele estar constantemente ebria y mantiene la música a un volumen elevado.;Ahora, si no le molesta, no me agrada demasiado tener a gente en mi vivienda, si pudiese salir estaría muy agradecido.;Y por cierto, la próxima vez, llame a la puerta.;#;;;;;;
